{
  "$schema": "https://json-schema.org/draft/2020-12/schema",
  "$id": "rusty.quest.native_app_feature.v1",
  "title": "Rusty Quest native app feature descriptor",
  "type": "object",
  "additionalProperties": false,
  "required": [
    "schema",
    "feature_id",
    "module_path",
    "module_kind",
    "settings_surface",
    "owner_lane",
    "status",
    "description",
    "provides",
    "depends_on",
    "incompatible_with",
    "exclusive_groups",
    "android_manifest",
    "runtime_profile",
    "build_inputs",
    "markers",
    "validation",
    "public_private_boundary"
  ],
  "properties": {
    "schema": {
      "const": "rusty.quest.native_app_feature.v1"
    },
    "feature_id": {
      "type": "string",
      "pattern": "^[a-z0-9_]+(\\.[a-z0-9_]+)*$"
    },
    "module_path": {
      "type": "string",
      "pattern": "^[a-z0-9_]+([-/][a-z0-9_]+)*$"
    },
    "module_kind": {
      "type": "string",
      "minLength": 1
    },
    "settings_surface": {
      "type": "object",
      "additionalProperties": false,
      "required": [
        "authority",
        "adapter"
      ],
      "properties": {
        "authority": {
          "const": "rusty.quest.native_app_settings.v1"
        },
        "adapter": {
          "type": "string",
          "enum": [
            "runtime_profile",
            "build_input",
            "manifest_only",
            "validation_only"
          ]
        }
      }
    },
    "owner_lane": {
      "type": "string",
      "minLength": 1
    },
    "status": {
      "type": "string",
      "enum": [
        "public-substrate",
        "public-app-feature",
        "private-app-adapter",
        "compatibility-surface",
        "damaged-fixture"
      ]
    },
    "description": {
      "type": "string",
      "minLength": 1
    },
    "provides": {
      "type": "array",
      "items": {
        "type": "string",
        "minLength": 1
      },
      "uniqueItems": true
    },
    "depends_on": {
      "type": "array",
      "items": {
        "type": "string",
        "minLength": 1
      },
      "uniqueItems": true
    },
    "incompatible_with": {
      "type": "array",
      "items": {
        "type": "string",
        "minLength": 1
      },
      "uniqueItems": true
    },
    "exclusive_groups": {
      "type": "object",
      "additionalProperties": {
        "type": "string",
        "minLength": 1
      }
    },
    "android_manifest": {
      "type": "object",
      "additionalProperties": false,
      "required": [
        "permissions",
        "uses_features",
        "activities",
        "services",
        "queries"
      ],
      "properties": {
        "permissions": {
          "type": "array",
          "items": {
            "type": "string"
          },
          "uniqueItems": true
        },
        "uses_features": {
          "type": "array",
          "items": {
            "type": "string"
          },
          "uniqueItems": true
        },
        "activities": {
          "type": "array",
          "items": {
            "type": "string"
          },
          "uniqueItems": true
        },
        "services": {
          "type": "array",
          "items": {
            "type": "string"
          },
          "uniqueItems": true
        },
        "queries": {
          "type": "array",
          "items": {
            "type": "string"
          },
          "uniqueItems": true
        }
      }
    },
    "runtime_profile": {
      "type": "object",
      "additionalProperties": false,
      "required": [
        "set",
        "clear_families",
        "expected_render_modes"
      ],
      "properties": {
        "set": {
          "type": "object",
          "additionalProperties": {
            "type": "string"
          }
        },
        "clear_families": {
          "type": "array",
          "items": {
            "type": "string",
            "minLength": 1
          },
          "uniqueItems": true
        },
        "expected_render_modes": {
          "type": "array",
          "items": {
            "type": "string",
            "minLength": 1
          },
          "uniqueItems": true
        }
      }
    },
    "build_inputs": {
      "type": "object",
      "additionalProperties": false,
      "required": [
        "env",
        "assets",
        "shaders"
      ],
      "properties": {
        "env": {
          "type": "array",
          "items": {
            "type": "object"
          }
        },
        "assets": {
          "type": "array",
          "items": {
            "type": "string"
          },
          "uniqueItems": true
        },
        "shaders": {
          "type": "array",
          "items": {
            "type": "string"
          },
          "uniqueItems": true
        }
      }
    },
    "markers": {
      "type": "object",
      "additionalProperties": false,
      "required": [
        "required",
        "forbidden"
      ],
      "properties": {
        "required": {
          "type": "array",
          "items": {
            "type": "string"
          },
          "uniqueItems": true
        },
        "forbidden": {
          "type": "array",
          "items": {
            "type": "string"
          },
          "uniqueItems": true
        }
      }
    },
    "validation": {
      "type": "object",
      "additionalProperties": false,
      "required": [
        "quick",
        "standard",
        "device"
      ],
      "properties": {
        "quick": {
          "type": "array",
          "items": {
            "type": "string"
          }
        },
        "standard": {
          "type": "array",
          "items": {
            "type": "string"
          }
        },
        "device": {
          "type": "array",
          "items": {
            "type": "string"
          }
        }
      }
    },
    "public_private_boundary": {
      "type": "string",
      "minLength": 1
    },
    "panel_composition": {
      "type": "object",
      "additionalProperties": false,
      "required": [
        "schema",
        "selected_module_id",
        "denied_module_ids",
        "modules"
      ],
      "properties": {
        "schema": {
          "const": "rusty.quest.native_renderer.panel_composition.v1"
        },
        "selected_module_id": {
          "type": "string",
          "pattern": "^[a-z0-9]+([.-][a-z0-9]+)*$"
        },
        "denied_module_ids": {
          "type": "array",
          "items": {
            "type": "string",
            "pattern": "^[a-z0-9]+([.-][a-z0-9]+)*$"
          },
          "uniqueItems": true
        },
        "modules": {
          "type": "array",
          "minItems": 1,
          "items": {
            "type": "object",
            "additionalProperties": false,
            "required": [
              "module_id",
              "entry_class",
              "dependencies",
              "source_files"
            ],
            "properties": {
              "module_id": {
                "type": "string",
                "pattern": "^[a-z0-9]+([.-][a-z0-9]+)*$"
              },
              "entry_class": {
                "type": "string"
              },
              "dependencies": {
                "type": "array",
                "items": {
                  "type": "string"
                },
                "uniqueItems": true
              },
              "source_files": {
                "type": "array",
                "items": {
                  "type": "string",
                  "pattern": "^apps/native-renderer-android/panel-modules/.+\\.java$"
                },
                "uniqueItems": true
              }
            }
          }
        }
      }
    },
    "panel_source_module": {
      "type": "object",
      "additionalProperties": false,
      "required": [
        "module_id",
        "entry_class",
        "dependencies",
        "source_files"
      ],
      "properties": {
        "module_id": {
          "const": "experiment-session-hub-status-provider"
        },
        "entry_class": {
          "const": ""
        },
        "dependencies": {
          "type": "array",
          "maxItems": 0
        },
        "source_files": {
          "type": "array",
          "minItems": 5,
          "maxItems": 5,
          "uniqueItems": true,
          "items": {
            "enum": [
              "apps/native-renderer-android/panel-modules/breath-composition/src/main/java/io/github/mesmerprism/rustyquest/native_renderer/ExperimentSessionHubLifetime.java",
              "apps/native-renderer-android/panel-modules/breath-composition/src/main/java/io/github/mesmerprism/rustyquest/native_renderer/ExperimentSessionAppStatusOwner.java",
              "apps/native-renderer-android/panel-modules/breath-composition/src/main/java/io/github/mesmerprism/rustyquest/native_renderer/ExperimentSessionHubProvider.java",
              "apps/native-renderer-android/panel-modules/breath-composition/src/main/java/io/github/mesmerprism/rustyquest/native_renderer/ExperimentSessionHubSurfaceClient.java",
              "crates/rusty-quest-broker-admission/android/io/github/mesmerprism/rustyquest/broker_admission/ConnectionHubAdmissionSessionReducer.java"
            ]
          }
        }
      }
    }
  },
  "allOf": [
    {
      "if": {
        "required": [
          "panel_source_module"
        ]
      },
      "then": {
        "properties": {
          "feature_id": {
            "const": "ui.experiment_session_hub_status_provider"
          }
        }
      }
    },
    {
      "if": {
        "properties": {
          "feature_id": {
            "const": "ui.experiment_session_hub_status_provider"
          }
        },
        "required": [
          "feature_id"
        ]
      },
      "then": {
        "required": [
          "panel_source_module"
        ]
      }
    }
  ]
}
