{
  "schema": "rusty.quest.native_app_feature.v1",
  "feature_id": "ui.hand_graft_camera_control_panel",
  "module_path": "ui/hand-graft-camera-panel",
  "module_kind": "same-apk-panel-mode",
  "settings_surface": {"authority": "rusty.quest.native_app_settings.v1", "adapter": "runtime_profile"},
  "owner_lane": "rusty-quest",
  "status": "public-app-feature",
  "description": "Same-APK projection placement, scale, and tracked hand/graft visual settings.",
  "provides": ["ui.hand_graft_camera_control_panel"],
  "depends_on": ["ui.same_apk_control_panel", "camera.hwb", "hand_mesh_visual", "projection_target.breathing_room"],
  "incompatible_with": ["renderer.stimulus_volume"],
  "exclusive_groups": {},
  "android_manifest": {"permissions": [], "uses_features": [], "activities": [], "services": [], "queries": []},
  "runtime_profile": {
    "set": {"debug.rustyquest.native_renderer.control_panel.mode": "hand-graft-camera"},
    "clear_families": [], "expected_render_modes": []
  },
  "build_inputs": {"env": [], "assets": [], "shaders": []},
  "markers": {"required": ["panelActivity=ControlPanelActivity"], "forbidden": []},
  "validation": {"quick": [], "standard": [], "device": []},
  "panel_composition": {
    "schema": "rusty.quest.native_renderer.panel_composition.v1",
    "selected_module_id": "hand-graft-camera-controls",
    "denied_module_ids": ["breath-composition-controls", "stimulus-volume", "private-particle-controls", "driver-profile-controls", "polar-sensor"],
    "modules": [{
      "module_id": "hand-graft-camera-controls",
      "entry_class": "io.github.mesmerprism.rustyquest.native_renderer.HandGraftCameraPanelModule",
      "dependencies": [],
      "source_files": ["apps/native-renderer-android/panel-modules/hand-graft-camera/src/main/java/io/github/mesmerprism/rustyquest/native_renderer/HandGraftCameraPanelModule.java"]
    }]
  },
  "public_private_boundary": "The Android panel submits bounded app-private scalar settings; native rendering retains geometry, tracking, skinning, and effective state."
}
