{
  "schema": "rusty.quest.native_app_feature.v1",
  "feature_id": "input.simultaneous_hands_and_controllers",
  "module_path": "input/simultaneous-hands-and-controllers",
  "module_kind": "openxr-input-mode-adapter",
  "settings_surface": {
    "authority": "rusty.quest.native_app_settings.v1",
    "adapter": "runtime_profile"
  },
  "owner_lane": "rusty-quest",
  "status": "public-substrate",
  "description": "Disabled-by-default native-renderer adapter for XR_META_simultaneous_hands_and_controllers with independently proven hand and controller readiness.",
  "provides": [
    "input.hand_tracking.concurrent",
    "input.controllers.concurrent"
  ],
  "depends_on": [
    "input.controllers_and_hands_optional",
    "hand_mesh_live_input",
    "hand_mesh_visual"
  ],
  "incompatible_with": [],
  "exclusive_groups": {
    "meta_hand_controller_input_mode": "simultaneous-hands-and-controllers"
  },
  "android_manifest": {
    "permissions": [],
    "uses_features": [],
    "activities": [],
    "services": [],
    "queries": []
  },
  "runtime_profile": {
    "set": {
      "debug.rustyquest.native_renderer.hand_adapter.enabled": "true",
      "debug.rustyquest.native_renderer.hand_adapter.feature_id": "hand-adapter-consumer",
      "debug.rustyquest.native_renderer.hand_adapter.lock_revision": "1",
      "debug.rustyquest.native_renderer.hand_adapter.lock_sha256": "A1391A7EF2C41F072032283E485F5A9EB58CAB3B74681F150CE24CD9262CF91D",
      "debug.rustyquest.native_renderer.hand_adapter.profile_id": "profile.quest.native_renderer.hand_adapter_conformance",
      "debug.rustyquest.native_renderer.hand_adapter.project_id": "native-renderer",
      "debug.rustyquest.native_renderer.simultaneous_hands_controllers.enabled": "true"
    },
    "clear_families": [
      "hand_adapter",
      "simultaneous_hands_controllers"
    ],
    "expected_render_modes": [
      "solid-black-hands-and-grafts"
    ]
  },
  "build_inputs": {
    "env": [],
    "assets": [],
    "shaders": []
  },
  "markers": {
    "required": [
      "simultaneousHandsControllersSelected=true",
      "extensionName=XR_META_simultaneous_hands_and_controllers",
      "extensionRequested=true",
      "extensionEnabled=true",
      "systemSupported=true",
      "functionsResolved=true",
      "handAdapterApplied=true",
      "handsCannotSubstituteController=true"
    ],
    "forbidden": [
      "XR_META_detached_controllers",
      "detachedControllersRequested=true"
    ]
  },
  "validation": {
    "quick": [
      "pwsh -NoProfile -File tools/checks/Test-NativeRendererSimultaneousHandsControllersStatic.ps1 -RepoRoot ."
    ],
    "standard": [],
    "device": []
  },
  "public_private_boundary": "Rusty Quest owns only exact activation, the Meta simultaneous tracking lifecycle, and neutral independent input readiness; applications retain all effect interpretation."
}
