{
  "schema": "rusty.quest.native_app_feature.v1",
  "feature_id": "renderer.private_particles",
  "module_path": "particles/private/renderer",
  "module_kind": "particle-aggregate",
  "settings_surface": {
    "authority": "rusty.quest.native_app_settings.v1",
    "adapter": "runtime_profile"
  },
  "owner_lane": "rusty-quest",
  "status": "public-substrate",
  "description": "Generic downstream-owned GPU private particle payload slot over the native renderer.",
  "provides": [
    "render.private_particle_billboards",
    "render.private_particle_payload_slot"
  ],
  "depends_on": [
    "quest.native.openxr_vulkan_base",
    "renderer.background.solid_black",
    "particles.private.payload_slot",
    "particles.private.ordering.gpu_index_remap",
    "particles.private.mask.r8_texture"
  ],
  "incompatible_with": [
    "camera.hwb",
    "display_composite",
    "environment_depth",
    "renderer.stimulus_volume",
    "sdf_visual",
    "video_projection"
  ],
  "exclusive_groups": {
    "primary_visual": "private-particles",
    "render_route": "solid-black-private-particles"
  },
  "android_manifest": {
    "permissions": [],
    "uses_features": [],
    "activities": [],
    "services": [],
    "queries": []
  },
  "runtime_profile": {
    "set": {
      "debug.rustyquest.native_renderer.render.mode": "solid-black-private-particles",
      "debug.rustyquest.native_renderer.camera.output": "disabled",
      "debug.rustyquest.native_renderer.display_composite.enabled": "false",
      "debug.rustyquest.native_renderer.display_composite.feedback.enabled": "false",
      "debug.rustyquest.native_renderer.display_composite.high_rate_json_payload": "false",
      "debug.rustyquest.native_renderer.environment_depth.mode": "disabled",
      "debug.rustyquest.native_renderer.environment_depth.high_rate_json_payload": "false",
      "debug.rustyquest.native_renderer.private_layer.enabled": "false",
      "debug.rustyquest.native_renderer.projection.target.controls": "false",
      "debug.rustyquest.native_renderer.replay.visual_proof.enabled": "false",
      "debug.rustyquest.native_renderer.sdf.visual.enabled": "false",
      "debug.rustyquest.native_renderer.stimulus_volume.enabled": "false",
      "debug.rustyquest.native_renderer.stimulus_volume.randomize.enabled": "false",
      "debug.rustyquest.native_renderer.video_projection.enabled": "false",
      "debug.rustyquest.native_renderer.video_projection.high_rate_json_payload": "false"
    },
    "clear_families": [
      "camera",
      "display_composite",
      "environment_depth",
      "hand_anchor_particles",
      "hand_mesh",
      "passthrough_style",
      "private_layer",
      "projection_target",
      "replay",
      "sdf",
      "stimulus_volume",
      "video_projection"
    ],
    "expected_render_modes": [
      "solid-black-private-particles"
    ]
  },
  "build_inputs": {
    "env": [],
    "assets": [],
    "shaders": [
      "apps/native-renderer-android/native/shaders/private_particles.vert.glsl",
      "apps/native-renderer-android/native/shaders/private_particles.frag.glsl"
    ]
  },
  "markers": {
    "required": [
      "renderMode=solid-black-private-particles",
      "customStereoProjectionEnabled=false",
      "nativePassthroughRequested=false",
      "solidBlackBackground=true",
      "RUSTY_QUEST_NATIVE_RENDERER channel=private-particle-slot",
      "RUSTY_QUEST_NATIVE_RENDERER channel=private-particle-anchor",
      "privateParticleWorldAnchorForwardAxis=",
      "privateParticleComputeFovTangentPayload=world-anchor-forward-axis",
      "privateParticleComputeBasisSource=captured-world-anchor",
      "privateParticleComputeBasisFollowCamera=false",
      "privateParticleDiagnosticStorageBinding=9",
      "privateParticleDiagnosticWords=24",
      "privateParticleDiagnosticTracerSpawnedCount=",
      "privateParticleDiagnosticTracerDiscardedCount=",
      "privateParticleDiagnosticAnchorEchoActiveCount=",
      "privateParticleDiagnosticAnchorEchoSpawnedCount=",
      "privateParticleDiagnosticAnchorEchoDiscardedCount=",
      "privateParticleDiagnosticActiveEdgeCount=",
      "privateParticleDiagnosticPassHealthFlags=",
      "privateParticleDiagnosticCpuFullBufferReadback=false",
      "privateParticleOrderingCpuExpandedUploadPerFrame=false"
    ],
    "forbidden": [
      "displayCompositeEnabled=true",
      "environmentDepthMode=scene-particle-map",
      "stimulusVolumeEnabled=true",
      "videoProjectionEnabled=true"
    ]
  },
  "validation": {
    "quick": [
      "powershell -NoProfile -ExecutionPolicy Bypass -File tools/Apply-RuntimeProfile.ps1 -ProfilePath <generated-profile> -DryRun -Out <generated-property-plan>"
    ],
    "standard": [],
    "device": []
  },
  "public_private_boundary": "Rusty Quest owns only the generic ABI slot, placeholder shader, and public markers; downstream repos own private particle semantics and payload data."
}
